Coordinates,Intro Number,Enactment Date,Enactment Year,Enactment Number,Category,Borough,New Name,Present Name,Membership,Biographical Information,Limits,Zip Code,Introduced by Council Member(s),Notes,geometry,centroid,latitude,longitude,pct_female_named_streets,pct_female_pop
"MULTILINESTRING ((-73.95303907799996 40.80843824900006, -73.95250995199996 40.808224159000076, -73.95285128799998 40.80774084900003, -73.95277085699996 40.80667383100007, -73.95356921199993 40.80699686100007, -73.95298628399996 40.80773787100003, -73.95303907799996 40.80843824900006))",Int. No. 22,07/29/2002,2002,2002/019,Street,Manhattan,Harriet Tubman Square,,Female,"The following biography was provided by “Spectrum: Home and School Magazine.” 

Harriet Tubman was born Harriet Ross in Dorchester County, Maryland in 1820. Her parents were from the Ashanti tribe of West Africa, and they worked as slaves on the Brod","the portions of Frederick Douglass Boulevard and St. Nicholas Avenue, extending from West 120th Street to West 122nd Street",10027,"Perkins, Lopez, Comrie, Davis, Foster, Koppell, Stewart, Weprin, Brewer and Barron also Council Members Baez, Gioia, Nelson, Vann, and Clarke",,"MULTILINESTRING ((-73.95303907799996 40.80843824900006, -73.95250995199996 40.808224159000076, -73.95285128799998 40.80774084900003, -73.95277085699996 40.80667383100007, -73.95356921199993 40.80699686100007, -73.95298628399996 40.80773787100003, -73.95303907799996 40.80843824900006))",POINT (-73.95297834313676 40.807534257675236),40.80753425767523,-73.95297834313676,26.5%,52%
"MULTILINESTRING ((-73.94301511099997 40.81589794900003, -73.94055284299998 40.81487485500003))",Int. No. 428-A,12/20/2010,2010,2011/003,Street,Manhattan,Madam C.J. & A’Lelia Walker Place,136th Street,Female,"Madam C.J. Walker was an African-American businesswoman, hair care entrepreneur and philanthropist.  She developed and marketed a successful line of beauty and hair care products and founded the Madam C.J. Walker Manufacturing Company.  Her business succ",Between Adam Clayton Powell Jr. Boulevard and Lenox Avenue,10037,Dickens,,"MULTILINESTRING ((-73.94301511099997 40.81589794900003, -73.94055284299998 40.81487485500003))",POINT (-73.94178397699997 40.81538640200003),40.81538640200003,-73.94178397699997,26.5%,52%
"MULTILINESTRING ((-73.82732744999998 40.83061195300007, -73.82663305599993 40.83095696500004))",Int. No. 342-A,02/18/2003,2003,2003/014,Street,Bronx,Marge Jeffries Way,Barkley Avenue,Female,"Marguerite “Marge” Jeffries was born on January 21, 1934.  Marge Jeffries was a longtime community activist on in Bronx Community Board No.  10.  She served as a member of the Community Board for 13 years, being elected as the Chair of the Parks Comm",Between East Tremont Avenue and Revere Avenue,10465,Provenzano,,"MULTILINESTRING ((-73.82732744999998 40.83061195300007, -73.82663305599993 40.83095696500004))",POINT (-73.82698025299996 40.83078445900006),40.83078445900006,-73.82698025299996,25.5%,53%
"MULTILINESTRING ((-73.95338598499995 40.63832467300006, -73.95211998199994 40.63718486400006))",Int. No. 1278,01/20/2024,2024,2024/041,Street,Brooklyn,Aracely Courtenay Way,Flatbush Avenue,Female,Aracely Courtenay served as the assistant pastor in Emmanuel Church of God. She spent eight years working in property management and coordinated housing for families with low incomes. She was in charge of the Talitha Cumi Women’s Ministry. She was hit,Between Foster Avenue and East 26th Street,11210,Louis,,"MULTILINESTRING ((-73.95338598499995 40.63832467300006, -73.95211998199994 40.63718486400006))",POINT (-73.95275298349995 40.63775476850006),40.63775476850006,-73.95275298349995,22.1%,52%
"MULTILINESTRING ((-73.88470675699995 40.74453263700008, -73.88503935099999 40.744052244000045))",Int. No. 471-A,12/21/2004,2004,2004/063,Street,Queens,Luz Colon Place,Baxter Avenue,Female,"Luz. C. Colon was born in Mayaquez, Puerto Rico and raised East Harlem attended grammer school at JHS in the East Harlem community, receiving a Bachelor’s degree from John Jay College, majoring in deviant behavior with a minor in Sociology.  Luz worked",between Broadway and Layton Street,11373,Monserrate,,"MULTILINESTRING ((-73.88470675699995 40.74453263700008, -73.88503935099999 40.744052244000045))",POINT (-73.88487305399997 40.74429244050006),40.74429244050006,-73.88487305399997,17.6%,51%
"MULTILINESTRING ((-73.91422574499995 40.75929681400004, -73.91382490299998 40.75867828200006))",Int. No. 1102-A,07/23/2023,2023,2023/110,Street,Queens,Dolma Naadhun Way,Newtown Road,Female,"Newtown Rd and 45th St has always been identified as a dangerous intersection by neighbors and communities who live there.  However, no concrete action was taken to make the street safer as DOT identifies this location as low-crash history. Unfortunately",Between 45th Street and 44th Street,11103,Won,,"MULTILINESTRING ((-73.91422574499995 40.75929681400004, -73.91382490299998 40.75867828200006))",POINT (-73.91402532399997 40.75898754800005),40.75898754800005,-73.91402532399997,17.6%,51%
"MULTILINESTRING ((-74.15311756099999 40.62569730700005, -74.15294053599996 40.62688820500006, -74.15282175699997 40.62768724800003, -74.15266159899994 40.62876464000004, -74.15251674699994 40.62983380500003, -74.15234881999999 40.630963422000036, -74.15212128699994 40.63249397100003, -74.15194472399997 40.63368163500007, -74.15178885599994 40.63463533200007, -74.15162133999996 40.63566028100007, -74.15148141699996 40.63651639500006, -74.15141376999998 40.63693028400007))",Int. No. 822,12/04/2001,2001,2001/060,Street,Staten Island,Kathy Kiernan Way,Simonson Avenue,Female,"The following biographical information was provided by Daytop Village, Inc. Staten Island Outreach, a drug-free therapeutic community facility on Staten Island. 

Kathy Kiernan was born on October 29, 1948.  Although she lived in Brooklyn, she called Sta",Between Forest Avenue and Richmond Terrace,10303,O’Donovan  and Abel,,"MULTILINESTRING ((-74.15311756099999 40.62569730700005, -74.15294053599996 40.62688820500006, -74.15282175699997 40.62768724800003, -74.15266159899994 40.62876464000004, -74.15251674699994 40.62983380500003, -74.15234881999999 40.630963422000036, -74.15212128699994 40.63249397100003, -74.15194472399997 40.63368163500007, -74.15178885599994 40.63463533200007, -74.15162133999996 40.63566028100007, -74.15148141699996 40.63651639500006, -74.15141376999998 40.63693028400007))",POINT (-74.15228481904805 40.63131674952371),40.63131674952371,-74.15228481904805,17.5%,51%
"MULTILINESTRING ((-74.01223655499996 40.677932025000075, -74.01175912199994 40.67833885300007))",Int. No. 988,07/29/2018,2018,2018/139,Street,Brooklyn,Sue Amendola Way,Van Brunt Street,Female,"Sue Amendola was an active member of the Red Hook Community for over 70 years.  She held leadership positions in the Ladies Auxiliary of the VFW NY Post 5195, Visitation of the Blessed Virgin Mary Church and the Red Hook Civic Association.  She led effor",Between King Street and Sullivan Street,11231,Menchaca,,"MULTILINESTRING ((-74.01223655499996 40.677932025000075, -74.01175912199994 40.67833885300007))",POINT (-74.01199783849995 40.67813543900007),40.67813543900007,-74.01199783849995,22.1%,52%
"MULTILINESTRING ((-73.87354078399994 40.75680909400006, -73.86568727599996 40.75763803800004, -73.86467876599994 40.75769086300005, -73.85898175399996 40.757898097000066))",Int. No. 1744,12/01/2017,2017,2017/237,Street,Queens,Helen Marshall Blvd,Northern Boulevard,Female,Helen Marshall founded and was the director of the Langston Hughes Library on Northern Boulevard in 1969.  She served in the State Assembly for eight years and then served on the City Council for 10 years.  She became the first African-America and the se,Between 94th Street and 111th Street,11368,Ferreras-Copeland,,"MULTILINESTRING ((-73.87354078399994 40.75680909400006, -73.86568727599996 40.75763803800004, -73.86467876599994 40.75769086300005, -73.85898175399996 40.757898097000066))",POINT (-73.86627003714968 40.75747684843977),40.75747684843977,-73.86627003714968,17.6%,51%
"MULTILINESTRING ((-73.71107611499997 40.744758224000066, -73.71044847799999 40.74309187500006))",Int. No. 1103-A,12/28/2009,2009,2009/092,Street,Queens,Ghanwatti Boodram Way,260th Street,Female,"Ghanwatti Boodram was killed when a Con Ed explosion took place on 260th Street between 80th and 81st Avenues in Floral Park, Queens.  She was in her home when it exploded.  Thousands of people in New York, Canada, England and her native Guyana mourned h",Between 80th Avenue and 81st Avenue,11004,Weprin,,"MULTILINESTRING ((-73.71107611499997 40.744758224000066, -73.71044847799999 40.74309187500006))",POINT (-73.71076229649998 40.74392504950006),40.74392504950006,-73.71076229649998,17.6%,51%
"MULTILINESTRING ((-73.85694034099998 40.89418771100003, -73.85730780399996 40.893510511000045))",Int. No. 2187,01/17/2021,2021,2021/014,Street,Bronx,Bishop Michel White Way,White Plains Road,Female,Bishop Michel White was the founder and pastor of the Cathedral at Greater Faith and served the Bronx community for over 30 years.  Her contributions were numerous as she worked tirelessly to support less fortunate members in the community by hosting an,Between 233rd Street and 234th Street,10466,Cohen,,"MULTILINESTRING ((-73.85694034099998 40.89418771100003, -73.85730780399996 40.893510511000045))",POINT (-73.85712407249997 40.89384911100004),40.89384911100004,-73.85712407249997,25.5%,53%
"MULTILINESTRING ((-73.96836083799997 40.79152026700007, -73.96574434299998 40.79041455400005))",Int. No. 825,10/10/2008,2008,2008/048,Street,Manhattan,Doris Rosenblum Way,South side of West 94th Street,Female,"Doris Rosenblum was an original member of the Mitchell Lama Residents’ Council, and for six years, served as co-chair.  She served as President of the Stryckers Bay Neighborhood Council, an organizations that supports affordable housing.  Ms. Rosenblum",Between Columbus Avenue and Central Park West,10025,Brewer,,"MULTILINESTRING ((-73.96836083799997 40.79152026700007, -73.96574434299998 40.79041455400005))",POINT (-73.96705259049997 40.79096741050006),40.79096741050006,-73.96705259049997,26.5%,52%
"MULTILINESTRING ((-73.89503463699998 40.66468080300007, -73.89515086599994 40.665137446000074, -73.89524172399996 40.66549440700004, -73.89532781299994 40.66583263100006, -73.89542487999995 40.666213982000045, -73.89546515599994 40.66637221500008, -73.89547860999994 40.666425074000074, -73.89548825399999 40.66646296400006, -73.89558803199998 40.66685496000008, -73.89578363999993 40.667623441000046, -73.89590558599997 40.66810252500005, -73.89603261299999 40.66860156400003, -73.89618534199997 40.66920157100003, -73.89629886099993 40.669647535000024, -73.89642328399998 40.67013633500005, -73.89653154299998 40.67056162800003, -73.89663949199996 40.67095823300008, -73.89682126099996 40.67167230100006, -73.89701864999995 40.67244772300006, -73.89715903399997 40.67299920000005, -73.89721871699999 40.67321846600004, -73.89744988899997 40.67412658000006, -73.89757110999994 40.674602769000046, -73.89766778299997 40.67498252200005, -73.89781708599998 40.675569015000065, -73.89793317999994 40.67602505200006, -73.89812446699995 40.67677645400005, -73.89820683699998 40.67707905100008))",Int. No. 342-A,02/18/2003,2003,2003/014,Street,Brooklyn,Mary Warren Place,Sheffield Avenue,Female,"Ms. Warren began her long career in community service with the New York City Housing Authority.  In her thirteen years there, she worked as a Community Associate, Community Liaison, and Community Service Aide.  During this time, Ms. Warren aided the East",between Fulton Street and Livonia Avenue,11207,Barron,,"MULTILINESTRING ((-73.89503463699998 40.66468080300007, -73.89515086599994 40.665137446000074, -73.89524172399996 40.66549440700004, -73.89532781299994 40.66583263100006, -73.89542487999995 40.666213982000045, -73.89546515599994 40.66637221500008, -73.89547860999994 40.666425074000074, -73.89548825399999 40.66646296400006, -73.89558803199998 40.66685496000008, -73.89578363999993 40.667623441000046, -73.89590558599997 40.66810252500005, -73.89603261299999 40.66860156400003, -73.89618534199997 40.66920157100003, -73.89629886099993 40.669647535000024, -73.89642328399998 40.67013633500005, -73.89653154299998 40.67056162800003, -73.89663949199996 40.67095823300008, -73.89682126099996 40.67167230100006, -73.89701864999995 40.67244772300006, -73.89715903399997 40.67299920000005, -73.89721871699999 40.67321846600004, -73.89744988899997 40.67412658000006, -73.89757110999994 40.674602769000046, -73.89766778299997 40.67498252200005, -73.89781708599998 40.675569015000065, -73.89793317999994 40.67602505200006, -73.89812446699995 40.67677645400005, -73.89820683699998 40.67707905100008))",POINT (-73.89661766492124 40.670880735694034),40.670880735694034,-73.89661766492124,22.1%,52%
"MULTILINESTRING ((-73.99597767499995 40.69908410600004, -73.99571615899998 40.69961484800007))",Int. No. 1613,06/24/2017,2017,2017/110,Street,Brooklyn,Emily Warren Roebling Way,Columbia Heights,Female,"Emily Warren Roebling married Washington Roebling on January 18, 1865.  Her father-in-law, John A. Roebling was undertaking the construction of the Brooklyn Bridge, but died in an unexpected accident.  Emily’s husband took over the role of Chief Engine",Between Pineapple Street and Orange Street,11201,Levin,good example,"MULTILINESTRING ((-73.99597767499995 40.69908410600004, -73.99571615899998 40.69961484800007))",POINT (-73.99584691699997 40.699349477000055),40.699349477000055,-73.99584691699997,22.1%,52%
"MULTILINESTRING ((-73.90649658299998 40.81469104700005, -73.90576433999996 40.81454894900003))",Int. No. 935,10/02/2012,2012,2012/048,Street,Bronx,Doris S. Torres Way,East 147th Street,Female,"On September 11, 2001, Doris S. Torres was working at Fiduciary Trust International on the 97th floor of the South Tower at the World Trade Center (WTC).  During the devastating attacks on the WTC, Ms. Torres helped an emotional colleague down a few flig",Between Wales Avenue and Tinton Avenue,10455,Arroyo,,"MULTILINESTRING ((-73.90649658299998 40.81469104700005, -73.90576433999996 40.81454894900003))",POINT (-73.90613046149997 40.81461999800004),40.81461999800004,-73.90613046149997,25.5%,53%
"MULTILINESTRING ((-73.94044488399999 40.78891092500004, -73.93823541399996 40.787981847000026))",Int. No. 556-A,06/14/2007,2007,2007/028,Street,Manhattan,Bernice Singletary Square,,Female,"Bernice Singletary migrated with her husband to New York in 1958 and worked with Marionat Bridal Veils, Inc. as a seamstress and later at the Board of Education as a Paraprofessional from 1968 until her retirement in June 1995.  She also served as the Wo",East 105th Street between First Avenue and the Service Road of the Franklin D. Roosevelt Drive,10029,Mark-Viverito,,"MULTILINESTRING ((-73.94044488399999 40.78891092500004, -73.93823541399996 40.787981847000026))",POINT (-73.93934014899997 40.78844638600003),40.78844638600003,-73.93934014899997,26.5%,52%
"MULTILINESTRING ((-73.94782053999995 40.66874387100006, -73.94788848899998 40.66800333500004))",Int. No. 1278,01/20/2024,2024,2024/041,Street,Brooklyn,The English Way,New York Avenue,Female,"Dr. Josephine English moved to Brooklyn in 1956 after graduating from medical school and working in Manhattan. She opened a women’s clinic in Bushwick and delivered thousands of babies, including the daughter of former United States Secretary of Commer",Between President Street and Union Street,11213,Hudson,,"MULTILINESTRING ((-73.94782053999995 40.66874387100006, -73.94788848899998 40.66800333500004))",POINT (-73.94785451449997 40.66837360300005),40.66837360300005,-73.94785451449997,22.1%,52%
"MULTILINESTRING ((-73.73749021199995 40.698285535000025, -73.73665604499996 40.699889969000026))",Int. No. 565,10/20/2003,2003,2003/062,Street,Queens,Betty Davis Street,221st Street,Female,"Betty Myrl Victoria Davis was the youngest of eleven siblings, six girls and five boys, born to George and Irene Davis on August 2, 1938. She grew up in her birthplace of Mavis Bank, Kingston, Jamaica never knowing her father who died when she was only t",Between 115th Road and 115th Avenue,11411,Comrie,,"MULTILINESTRING ((-73.73749021199995 40.698285535000025, -73.73665604499996 40.699889969000026))",POINT (-73.73707312849996 40.699087752000025),40.699087752000025,-73.73707312849996,17.6%,51%
"MULTILINESTRING ((-73.77699922599999 40.68630265300004, -73.77503227299997 40.686967054000036))",Int. No. 1278,01/20/2024,2024,2024/041,Street,Queens,Ethel L. Cuff Black Way,Foch Boulevard,Female,"Ethel L. Cuff Black was an educator and one of the founders of Delta Sigma Theta sorority, which now has 600 chapters and 95,000 members worldwide. She became the first African-American school teacher in Richmond Hills where she taught for over 27 years.",Between Merrick Boulevard and 170th Street,11434,Williams,,"MULTILINESTRING ((-73.77699922599999 40.68630265300004, -73.77503227299997 40.686967054000036))",POINT (-73.77601574949998 40.68663485350004),40.68663485350004,-73.77601574949998,17.6%,51%
"MULTILINESTRING ((-73.90557436499995 40.82905260800004, -73.90597133099999 40.828455923000035, -73.90628246799997 40.828198170000064))",Int. No. 761-A,03/07/2012,2012,2012/014,Street,Bronx,Meg Charlop Way,Fulton Avenue,Female,"Meg Charlop moved to the Bronx in 1976 and worked as a community and housing organizer in the Morrisania section of the Borough.  For 26 years, she worked for the Montefiore Medical Center and became a city-wide and national leader in the fight against c",Between East 166th Street and East 167th Street,10456,Foster,,"MULTILINESTRING ((-73.90557436499995 40.82905260800004, -73.90597133099999 40.828455923000035, -73.90628246799997 40.828198170000064))",POINT (-73.90590048986303 40.828600245451845),40.828600245451845,-73.90590048986303,25.5%,53%
"MULTILINESTRING ((-73.96255460499998 40.67150316300007, -73.96191516599998 40.66827742900006, -73.96140786299998 40.66571815900005, -73.96100965299996 40.663449928000034, -73.96077361799996 40.66175061700005, -73.96067186599998 40.66101804200008))",Int. No. 746-A,12/29/2005,2005,2005/131,Street,Brooklyn,Mary Pinkett Avenue,Washington Avenue,Female,"Mary Pinkett was the first African- American woman elected to the New York City Council, and served her community by fighting passionately for the underrepresented and overlooked.",Between Eastern Parkway and Lincoln Road,11225,James and Clarke,,"MULTILINESTRING ((-73.96255460499998 40.67150316300007, -73.96191516599998 40.66827742900006, -73.96140786299998 40.66571815900005, -73.96100965299996 40.663449928000034, -73.96077361799996 40.66175061700005, -73.96067186599998 40.66101804200008))",POINT (-73.96155150051644 40.666271147682444),40.66627114768245,-73.96155150051644,22.1%,52%
"MULTILINESTRING ((-73.88705844699996 40.81670603300006, -73.88683582399995 40.81581083700007, -73.88688142099994 40.81571746000003))",Int. No. 2477,01/15/2022,2022,2022/054,Street,Bronx,Mrs. Esther ‘Marie’ Davis Way,,Female,"Marie Davis was a parent, teacher and activist leader in the Hunts Point community for nearly four decades. Mrs. Davis moved to 750 Faile Street in 1977, and raised her eight children there. Soon after moving to the area, Mrs. Davis began working at P.S.",Faile Street between Lafayette Avenue and Hunts Point Avenue,10474,Salamanca,,"MULTILINESTRING ((-73.88705844699996 40.81670603300006, -73.88683582399995 40.81581083700007, -73.88688142099994 40.81571746000003))",POINT (-73.88693817404256 40.81620839119403),40.81620839119403,-73.88693817404256,25.5%,53%
"MULTILINESTRING ((-73.92876193599994 40.68199269200005, -73.92602608299995 40.68230999900004))",Int. No. 1300,01/20/2019,2019,2019/024,Street,Brooklyn,Fannie Pettie Watts Way,Decatur Street,Female,"Fannie Pettie was born in Perry, Georgia and attended public school in Savannah, Georgia. She continued her formal training at Georgia State College and later graduated from Howard University with a Bachelor of Arts degree in Education. She also achieved",Between Patchen Avenue and Malcom X Boulevard,11233,Cornegy Jr.,,"MULTILINESTRING ((-73.92876193599994 40.68199269200005, -73.92602608299995 40.68230999900004))",POINT (-73.92739400949995 40.682151345500046),40.682151345500046,-73.92739400949995,22.1%,52%
"MULTILINESTRING ((-73.90853296699999 40.83390489100003, -73.90590708399998 40.83304239800003, -73.90513757199994 40.83278964400006))",Int. No. 825,10/10/2008,2008,2008/048,Street,Bronx,Ms. Rachel E. Spivey Boulevard,East 169th Street,Female,"Rachel E. Spivey was the Executive Director of the Claremont Neighborhood Centers, Inc. for a number of years.  She received the 2002 New York State Woman of Distinction Award from State Senator Pedro Espada, Jr.  Ms. Spivey was also active with Bronx Co",Between Third Avenue and Webster Avenue,10456,Foster,,"MULTILINESTRING ((-73.90853296699999 40.83390489100003, -73.90590708399998 40.83304239800003, -73.90513757199994 40.83278964400006))",POINT (-73.90683526933763 40.83334726799427),40.83334726799427,-73.90683526933763,25.5%,53%
"MULTILINESTRING ((-73.90297257999998 40.851415891000045, -73.90392476399995 40.85160660200006))",Int. No. 877-A,12/29/2008,2008,2008/064,Street,Bronx,Reverend Jessie Woodhouse Place,Bush Street,Female,Pastor Woodhouse received many certificates and awards for her dedication and commitment to the church and her community. She is responsible for forming the First Bible Church of the Lord’s Mission and the Woodhouse Bible School for religious education,On the corner of the Grand Concourse between 179th Street and East Burnside Avenue,10457,Baez,,"MULTILINESTRING ((-73.90297257999998 40.851415891000045, -73.90392476399995 40.85160660200006))",POINT (-73.90344867199997 40.85151124650005),40.85151124650005,-73.90344867199997,25.5%,53%
"MULTILINESTRING ((-73.90236813999996 40.670930816000066, -73.91984541399995 40.66834712600007, -73.92188389199998 40.66851395000003))",Int. No. 931-A,04/20/2009,2009,2009/025,Street,Brooklyn,Mother Gloria A. Boyce Way,Pitkin Avenue,Female,"Gloria A. Boyce served the central Brooklyn area for over forty years.  She was a member of the Brownsville Community Council Board, the Community Progress Center, the Marcus Garvey Urban Renewal and founded the LaVaughn Moore Day Care Center, in East Ne",Between Eastern Parkway and Van Sinderen Avenue,11212,Mealy,,"MULTILINESTRING ((-73.90236813999996 40.670930816000066, -73.91984541399995 40.66834712600007, -73.92188389199998 40.66851395000003))",POINT (-73.91211921600289 40.66951358872409),40.66951358872409,-73.91211921600289,22.1%,52%
"MULTILINESTRING ((-73.86276827799998 40.73908707700008, -73.86081026599999 40.73955856500004))",Int. No. 457,12/05/2006,2006,2006/050,Street,Queens,Genesis Regalado Way,55th Avenue,Female,"Genesis Regalado was a student at IS 61 Queens on 50th Avenue in Corona, Queens and was a well-known and popular member of the local community. Tragically, she was shot and killed by a stray bullet fired from a moving car on 55th Avenue between 98th and",Between 98th and 99th Streets,11368,Sears,,"MULTILINESTRING ((-73.86276827799998 40.73908707700008, -73.86081026599999 40.73955856500004))",POINT (-73.86178927199998 40.73932282100006),40.73932282100006,-73.86178927199998,17.6%,51%
"MULTILINESTRING ((-73.89517137499996 40.669380079000064, -73.89251598799996 40.669791029000066, -73.89036217399996 40.67009211900006, -73.88782124199997 40.670485351000025, -73.88596335099999 40.67075736000004, -73.88354772999998 40.67111102400003, -73.88190678399997 40.67135126800008, -73.87932684599997 40.67172898600006, -73.87596796899999 40.67222074100005, -73.87455682099994 40.67239819400004, -73.86393080099998 40.673953864000055))",Int. No. 968,07/20/2024,2024,2024/081,Street,Brooklyn,Honorable Priscilla A. Wooten Way,Sutter Avenue,Female,"The Honorable Deaconess Priscilla A. Wooten assisted in the securing of the property now known as ""New Grace Center"" and availed herself in any capacity that fulfilled the programs of the church. Priscilla also held membership at the Greater Bright Light",Between Pennsylvania Avenue and Elderts Lane,11208,Banks,,"MULTILINESTRING ((-73.89517137499996 40.669380079000064, -73.89251598799996 40.669791029000066, -73.89036217399996 40.67009211900006, -73.88782124199997 40.670485351000025, -73.88596335099999 40.67075736000004, -73.88354772999998 40.67111102400003, -73.88190678399997 40.67135126800008, -73.87932684599997 40.67172898600006, -73.87596796899999 40.67222074100005, -73.87455682099994 40.67239819400004, -73.86393080099998 40.673953864000055))",POINT (-73.87955331479269 40.67168187467331),40.67168187467331,-73.87955331479269,22.1%,52%
"MULTILINESTRING ((-73.94538077299995 40.81269995500003, -73.94284730399994 40.81162587500006))",Int. No. 2477,01/15/2022,2022,2022/054,Street,Manhattan,Judge Sheila Abdus Salaam Way,West 131st Street,Female,"Judge Sheila Abdus Salaam was born in Washington, D.C. in 1952 and educated in its public schools. She graduated from Barnard College in 1974, and received her J.D. from Columbia Law School in 1977. Upon graduation, she began her legal career as a staff",Between Adam Clayton Powell Boulevard and Malcolm X Boulevard,10037,Perkins,,"MULTILINESTRING ((-73.94538077299995 40.81269995500003, -73.94284730399994 40.81162587500006))",POINT (-73.94411403849995 40.812162915000044),40.812162915000044,-73.94411403849995,26.5%,52%
