"MULTILINESTRING ((-73.90090467999994 40.86270734800007, -73.89932461499995 40.862161495000066, -73.89763726099994 40.86243073400004, -73.89685698199997 40.862452863000044, -73.89447713199996 40.862036096000054, -73.89272150399995 40.861836932000074, -73.89197117499998 40.86185821200007, -73.89143163499995 40.86163269900004, -73.89035140699997 40.86108821700003))",Int. No. 565,10/20/2003,2003,2003/062,Street,Bronx,Celia Cruz Boulevard,Fordham Road,Female,"(The following biographical information was provided by the “All Music Guide” and “Thomson Gale” websites.) 

Celia Cruz was one of Latin music's most respected vocalists. A ten-time Grammy nominee, Cruz, who sang only in her native Spanish langu",between Third Avenue and Jerome Avenue,10468,Rivera and Miller,,"MULTILINESTRING ((-73.90090467999994 40.86270734800007, -73.89932461499995 40.862161495000066, -73.89763726099994 40.86243073400004, -73.89685698199997 40.862452863000044, -73.89447713199996 40.862036096000054, -73.89272150399995 40.861836932000074, -73.89197117499998 40.86185821200007, -73.89143163499995 40.86163269900004, -73.89035140699997 40.86108821700003))",POINT (-73.89559675191218 40.862093547759024),40.862093547759024,-73.89559675191218,25.5%,53%
"MULTILINESTRING ((-73.93788345799999 40.803755814000056, -73.93734969799993 40.80448265900003, -73.93683302699998 40.805186227000036, -73.93632964499994 40.80587169000006, -73.93574305499999 40.80669359900003, -73.93547729499994 40.80706597000005, -73.93469141999998 40.80813607600004))",Int. No. 771,12/04/2001,2001,2001/060,Street,Manhattan,Alice Kornegay Way,Lexington Avenue,Female,"The following biographical information was provided by the Abyssinian Baptist Church and the Community Association of the East Harlem Triangle, Inc.   

Alice Grace Wragg Kornegay was born in May of 1930 in Georgetown, South Carolina and came to Harlem a",between East 124 th Street and East 131st Street,10035,"Perkins, Reed, and O’Donovan",,"MULTILINESTRING ((-73.93788345799999 40.803755814000056, -73.93734969799993 40.80448265900003, -73.93683302699998 40.805186227000036, -73.93632964499994 40.80587169000006, -73.93574305499999 40.80669359900003, -73.93547729499994 40.80706597000005, -73.93469141999998 40.80813607600004))",POINT (-73.9362855197071 40.805944555573475),40.805944555573475,-73.9362855197071,26.5%,52%
"MULTILINESTRING ((-73.98663907999997 40.66098154100007, -73.98618578699995 40.66142509600007))",Int. No. 289-A,05/23/2006,2006,2006/013,Street,Brooklyn,Ms. Marion Dombkowski Way,7th Avenue,Female,"Marion Dombkowski was born in Garfield, New Jersey and was the youngest of four children. She later married, raised two children and moved to Brooklyn. She was an exemplary woman whose service as a crossing guard at IS 88 for 28 years kept many students",Between Prospect Avenue and 17th Street,11215,Gonzalez,,"MULTILINESTRING ((-73.98663907999997 40.66098154100007, -73.98618578699995 40.66142509600007))",POINT (-73.98641243349996 40.66120331850007),40.66120331850007,-73.98641243349996,22.1%,52%
"MULTILINESTRING ((-73.91307615599999 40.70919801300005, -73.91412817899999 40.708158817000026))",Int. No. 457,12/05/2006,2006,2006/050,Street,Brooklyn,Pauline Leblond Way,Stockholm Street,Female,"Pauline Leblond served as President of the Stockholm Street Block Association and led the fight to gain historic landmark status from the City for Stockholm Street, between Onderdonk and Woodward Avenues in Ridgewood. She was instrumental in obtaining fu",Between Woodward Avenue and Onderdonk Avenue,11385,Reyna and Gallagher,,"MULTILINESTRING ((-73.91307615599999 40.70919801300005, -73.91412817899999 40.708158817000026))",POINT (-73.91360216749999 40.70867841500004),40.70867841500004,-73.91360216749999,22.1%,52%
"MULTILINESTRING ((-73.96441366199997 40.68129927200005, -73.96772672699996 40.69760869400005))",Int. No. 613,05/09/2005,2005,2005/043,Street,Brooklyn,Mary Pinkett Avenue,Washington Avenue,Female,"The first black woman elected to the council, Mary Pinkett served for 28 years representing neighborhoods that included Clinton Hill, Fort Greene, Prospect Heights, Bedford-Stuyvesant, and Crown Heights.  She was first elected in November 1973 from the 2",Between Flushing and Atlantic Avenues,11238,James,,"MULTILINESTRING ((-73.96441366199997 40.68129927200005, -73.96772672699996 40.69760869400005))",POINT (-73.96607019449996 40.68945398300005),40.68945398300005,-73.96607019449996,22.1%,52%
"MULTILINESTRING ((-73.88692743799999 40.835164520000035, -73.88601012199996 40.83667839300006))",Int. No. 556-A,06/14/2007,2007,2007/028,Street,Bronx,Ruth Poindexter Plaza,Vyse Avenue,Female,"Ruth Poindexter was born in Norfolk, Virginia to the late John Gordon and Mattie Ruth Redding. Ruth graduated from the High School of Fashion Industries and attended Queens College for a short time. She has been vice president of C.S. 57, secretary of I.",Between East 173rd Street and East 174th Street,10460,Rivera,,"MULTILINESTRING ((-73.88692743799999 40.835164520000035, -73.88601012199996 40.83667839300006))",POINT (-73.88646877999997 40.835921456500046),40.835921456500046,-73.88646877999997,25.5%,53%
"MULTILINESTRING ((-73.94322116099994 40.68032770000008, -73.93774349399996 40.68096052100003))",Int. No. 1227,08/03/2016,2016,2016/092,Street,Brooklyn,Tohma Y. Faulkner Way,Decatur Street,Female,"Tohma Y. Faulkner served as 2nd vice chair on Community Board 3 and also served on the board of directors for Vannguard Urban Improvement Association, was the former president of the Brownstoners, was a member of the steering committee for the Bedford-St",Between Tompkins Avenue and Marcus Garvey Boulevard,11216,Cornegy,,"MULTILINESTRING ((-73.94322116099994 40.68032770000008, -73.93774349399996 40.68096052100003))",POINT (-73.94048232749995 40.680644110500054),40.680644110500054,-73.94048232749995,22.1%,52%
"MULTILINESTRING ((-73.91655480599997 40.869359694000025, -73.91588425399993 40.869760281000026))",Int. No. 1227,08/03/2016,2016,2016/092,Street,Manhattan,Renee Mancino Way,Broadway,Female,"Renee Mancino was the owner of Carrot Top Pastries, a staple bakery in Washington Heights and Inwood. Following her death, a memorial service was held at the Riverdale Funeral Home where hundreds of people gathered to listen to speeches and honor her mem",Between 214th Street and 215th Street,10034,Rodriguez,,"MULTILINESTRING ((-73.91655480599997 40.869359694000025, -73.91588425399993 40.869760281000026))",POINT (-73.91621952999995 40.869559987500025),40.869559987500025,-73.91621952999995,26.5%,52%
"MULTILINESTRING ((-73.75928032499996 40.59709272500004, -73.75983822399996 40.59778313400005, -73.76043867499999 40.598526192000065, -73.76110690899998 40.59933092600005, -73.76148799899994 40.59980251500008))",Int. No. 437-A,06/03/2003,2003,2003/034,Street,Queens,Hon. Pauline Rhodd- Cummings Drive,Beach 25th Street,Female,"Assemblywoman Pauline Rhodd-Cummings, born in Jamaica, West Indies, was a 25 year resident of The Rockaways.  She passed away on January 27, 2002 after a year-long battle with cancer at the age of 56.  She served in the New York State Assembly for 8 year",Between Rockaway  Freeway and Camp Road,11691,"Sanders, Jr.",,"MULTILINESTRING ((-73.75928032499996 40.59709272500004, -73.75983822399996 40.59778313400005, -73.76043867499999 40.598526192000065, -73.76110690899998 40.59933092600005, -73.76148799899994 40.59980251500008))",POINT (-73.76038224837177 40.59844918754443),40.59844918754443,-73.76038224837177,17.6%,51%
"MULTILINESTRING ((-73.98825274499995 40.68586589100005, -73.98617135099994 40.685056391000046))",Int. No. 849,08/10/2015,2015,2015/076,Street,Brooklyn,Briana Ojeda Way,Bergen Street,Female,"Briana Ojeda was an 11-year-old girl from Brooklyn who died tragically in after suffering an asthma attack. As Briana's mother was rushing her to the hospital, she was stopped by a police officer, who failed to administer life-saving CPR, claiming he was",Between Hoyt Street and Bond Street,11201,Levin,,"MULTILINESTRING ((-73.98825274499995 40.68586589100005, -73.98617135099994 40.685056391000046))",POINT (-73.98721204799995 40.68546114100005),40.68546114100005,-73.98721204799995,22.1%,52%
"MULTILINESTRING ((-73.90080501299997 40.844442024000045, -73.89968384999997 40.84431114900008))",Int. No. 428-A,12/20/2010,2010,2011/003,Street,Bronx,Police Officer Jill Garcia Place,Cross Bronx Expressway,Female,"Police Officer Jill Garcia entered the New York City Police Academy in September 2000.  She was assigned to the 46th Precinct upon her graduation from the Police Academy.  In 2003, she was transferred to the 48th Precinct where she worked on patrol a",Between Park Avenue and Washington Avenue,10457,Rivera,,"MULTILINESTRING ((-73.90080501299997 40.844442024000045, -73.89968384999997 40.84431114900008))",POINT (-73.90024443149997 40.84437658650006),40.84437658650006,-73.90024443149997,25.5%,53%
"MULTILINESTRING ((-73.94788013499993 40.66703362000004, -73.94532667199996 40.66689120600006))",Int. No. 988,07/29/2018,2018,2018/139,Street,Brooklyn,Sarah and Michoel Behrman Way,Carroll Street,Female,"Sarah Behrman was an educator and advocate for the less fortunate.  She worked for Hebrew Academy For Special Children, the Jewish educational and clinical social service agency for people with special needs.   In addition to using the resources availabl",Between Brooklyn Avenue and New York Avenue,11213,Cumbo,,"MULTILINESTRING ((-73.94788013499993 40.66703362000004, -73.94532667199996 40.66689120600006))",POINT (-73.94660340349995 40.66696241300005),40.66696241300005,-73.94660340349995,22.1%,52%
"MULTILINESTRING ((-73.93975681299997 40.83951211300007, -73.93930754299998 40.83932948300003))",Int. No. 388,07/09/2014,2014,2014/034,Street,Manhattan,Altagracia Diloné Levat Way,166th Street,Female,"Altagracia Diloné Levat was the director of the Alianza Dominicana Cultural Center, which was funded by the New York City Council and administered by Catholic Charities of New York.  She initiated and oversaw classical and folkloric music programs, as w",Between St. Nicholas Avenue and Audubon Avenue,10032,Rodriguez,,"MULTILINESTRING ((-73.93975681299997 40.83951211300007, -73.93930754299998 40.83932948300003))",POINT (-73.93953217799998 40.83942079800005),40.83942079800005,-73.93953217799998,26.5%,52%
"MULTILINESTRING ((-73.89577003199997 40.84933995800003, -73.89648926099994 40.84807751400007))",Int. No. 825,10/10/2008,2008,2008/048,Street,Bronx,Carmen B. Bermudez Place,Bathgate Avenue,Female,"Carmen B. Bermudez was the founder of the Upper Bronx Neighborhood Association for Puerto Rican Affairs, Inc (NAPRA).  Under her leadership, the NAPRA was awarded a grant for a day care center which provided assistance to community children with special",Between East 178th  Street and East 179th Street,10457,Rivera,,"MULTILINESTRING ((-73.89577003199997 40.84933995800003, -73.89648926099994 40.84807751400007))",POINT (-73.89612964649996 40.84870873600005),40.84870873600005,-73.89612964649996,25.5%,53%
"MULTILINESTRING ((-73.85165081099996 40.82146143500006, -73.84881958999995 40.82184934400004))",Int. No. 457,12/05/2006,2006,2006/050,Street,Bronx,Allison C. Rivera-Roman’s Place,Homer Avenue,Female,"Allison Rivera-Roman lived her whole life in the Bronx. As a teenager, Allison was a vibrant and active student at Christopher Columbus High School where she was well known by her classmates and teaching staff. At her high school graduation, the school",Between Olmstead and Castle Hill Avenue,10473,Palma,,"MULTILINESTRING ((-73.85165081099996 40.82146143500006, -73.84881958999995 40.82184934400004))",POINT (-73.85023520049995 40.82165538950005),40.82165538950005,-73.85023520049995,25.5%,53%
"MULTILINESTRING ((-73.99089103299997 40.76104881800006, -73.99349009299993 40.76214790900008))",Int No. 2477,01/15/2022,2022,2022/054,Street,Manhattan,Frances Perkins Place,West 46th Street,Female,"Frances Perkins is considered by many historians to be one of the most import American female government officials of the 20th Century. For all four terms of Franklin Roosevelt’s administration she served as Secretary of Labor, the first woman to hold",Between Ninth Avenue and Tenth Avenue,10036,Johnson,,"MULTILINESTRING ((-73.99089103299997 40.76104881800006, -73.99349009299993 40.76214790900008))",POINT (-73.99219056299995 40.76159836350007),40.76159836350007,-73.99219056299995,26.5%,52%
"MULTILINESTRING ((-74.07531782399997 40.595139688000074, -74.07461051499996 40.595375036000064))",Int. No. 825,10/10/2008,2008,2008/048,Street,Staten Island,Loretta Quinn Way,McClean Avenue,Female,"Loretta Quinn completed her bachelor’s degree in Political Science at Staten Island Community College and graduated Magna Cum Laude in 1976.  Soon after, she devoted much of her time to serving the youth of Staten Island, especially runaways and underp",Between Jerome Avenue and Bionia Avenue,10305,Oddo,,"MULTILINESTRING ((-74.07531782399997 40.595139688000074, -74.07461051499996 40.595375036000064))",POINT (-74.07496416949996 40.59525736200007),40.59525736200007,-74.07496416949996,17.5%,51%
"MULTILINESTRING ((-73.88336630299995 40.74978402600004, -73.88301493299997 40.747829257000035))",Int. No. 2187,01/17/2021,2021,2021/014,Street,Queens,Lorena Borjas Way,83rd Street,Female,"Lorena Borjas was born in Veracruz, Mexico in 1960 and came to the United States in 1980. She became an advocate for the LGBT Community and inspired many people. She made sure people were treated fair and justly whether it be at health clinics or courtho",Between 37th Avenue and Roosevelt Avenue,11372,Moya,,"MULTILINESTRING ((-73.88336630299995 40.74978402600004, -73.88301493299997 40.747829257000035))",POINT (-73.88319061799996 40.74880664150004),40.74880664150004,-73.88319061799996,17.6%,51%
"MULTILINESTRING ((-73.93996091299994 40.78959125100005, -73.93790902299997 40.78872564300008))",Int. No. 556-A,06/14/2007,2007,2007/028,Street,Manhattan,Bernice Singletary Square,,Female,"Bernice Singletary migrated with her husband to New York in 1958 and worked with Marionat Bridal Veils, Inc. as a seamstress and later at the Board of Education as a Paraprofessional from 1968 until her retirement in June 1995.  She also served as the Wo","East 106th Street between First Avenue and the Service Road of the Franklin D. Roosevelt Drive,",10029,Mark-Viverito,,"MULTILINESTRING ((-73.93996091299994 40.78959125100005, -73.93790902299997 40.78872564300008))",POINT (-73.93893496799996 40.78915844700006),40.78915844700006,-73.93893496799996,26.5%,52%
"MULTILINESTRING ((-73.89961839399996 40.66400424500006, -73.90022256099996 40.666424326000026, -73.90140675699996 40.670989586000076))",Int. No. 388,07/09/2014,2014,2014/034,Street,Brooklyn,Lillie F. Martin Lane,Snediker Avenue,Female,"Lillie F. Martin was very involved with Anti-Poverty Programs, Youth Action Programs and GED Programs in East New York.  She was the first to offer food pantry’s in East New York and mediate relationships with the gangs of the 1970’s by formulating g",Between Livonia Avenue and Pitkin Avenue,11212,Barron,,"MULTILINESTRING ((-73.89961839399996 40.66400424500006, -73.90022256099996 40.666424326000026, -73.90140675699996 40.670989586000076))",POINT (-73.9005053400504 40.66749875702679),40.66749875702679,-73.9005053400504,22.1%,52%
"MULTILINESTRING ((-74.00597079199997 40.735800976000064, -74.00606615899994 40.735202550000054))",Int. No. 457,12/05/2006,2006,2006/050,Street,Manhattan,Jane Jacobs Way,Hudson Street,Female,Jane Jacobs was a figure of extraordinary influence in Greenwich Village and throughout the world. Her leading efforts helped thwart the construction of the Lower Manhattan Expressway and achieve numerous other invaluable accomplishments preserving the q,Between Perry Street and West 11th Street,10014,Quinn,,"MULTILINESTRING ((-74.00597079199997 40.735800976000064, -74.00606615899994 40.735202550000054))",POINT (-74.00601847549996 40.73550176300006),40.73550176300006,-74.00601847549996,26.5%,52%
"MULTILINESTRING ((-74.14472839999996 40.537700888000074, -74.14539358799993 40.53714439700008))",Int. No. 565,10/20/2003,2003,2003/062,Street,Staten Island,Mary Davies Drive,Tennyson Drive,Female,"Mary Davies was born on March 22, 1926, in the borough of Brooklyn, to Thomas and Helen Davies. Mary received her education attending various Brooklyn public schools, until her marriage to John Davies in 1937. Mary and her husband moved to Staten Island",between Glover Street and Goodall Street,10308,Lanza,,"MULTILINESTRING ((-74.14472839999996 40.537700888000074, -74.14539358799993 40.53714439700008))",POINT (-74.14506099399995 40.537422642500076),40.53742264250008,-74.14506099399995,17.5%,51%
"MULTILINESTRING ((-73.91840242699999 40.749408852000045, -73.91892694699999 40.74675821300008))",Int. No. 849,08/10/2015,2015,2015/076,Street,Queens,Marjorie Sewell Cautley Way,45th Street,Female,Marjorie Sewell Cautley was an American landscape architect who was very interested in the design of communal spaces and is remembered by her community as being instrumental in the design of the beautiful neighborhood.  She is known for having worked on,Between Skillman Avenue and 39th Avenue,11104,Van Bramer,,"MULTILINESTRING ((-73.91840242699999 40.749408852000045, -73.91892694699999 40.74675821300008))",POINT (-73.91866468699999 40.74808353250006),40.74808353250006,-73.91866468699999,17.6%,51%
"MULTILINESTRING ((-73.94262532199997 40.72572500700005, -73.94222477899996 40.72335078300006))",Int. No. 1278,01/20/2024,2024,2024/041,Street,Brooklyn,Patricia R. Tambakis Way,Monitor Street,Female,Patricia R. Tambakis was the founder of Friends of McGoldrick Park in the early 1980’s. She held numerous fundraisers to provide permits and arrange activities for the kids in the community to play in the park. She organized educational programs such a,Between Driggs Avenue and Nassau Avenue,11222,Restler,,"MULTILINESTRING ((-73.94262532199997 40.72572500700005, -73.94222477899996 40.72335078300006))",POINT (-73.94242505049996 40.724537895000054),40.724537895000054,-73.94242505049996,22.1%,52%
"MULTILINESTRING ((-73.91342959099995 40.88709763700007, -73.91357174799998 40.88679347300007, -73.91410550799998 40.886398059000044))",Int. No. 620,02/05/2015,2015,2015/015,Street,Bronx,Debbie Bowden Way,Independence Avenue,Female,"Debbie Bowden was a Bronx resident and served her community for over 50 years in Council District 11, Community Board 8, and the neighborhoods of Riverdale, Kingsbridge, and Spuyten Duyvil. She left an enduring and lasting legacy of good acts in many sec",Between West 235th Street and West 236th Street,10463,Cohen,,"MULTILINESTRING ((-73.91342959099995 40.88709763700007, -73.91357174799998 40.88679347300007, -73.91410550799998 40.886398059000044))",POINT (-73.91372516171604 40.886713204259465),40.886713204259465,-73.91372516171604,25.5%,53%
"MULTILINESTRING ((-73.91674851399995 40.780411109000056, -73.91586835199996 40.779777729000045))",Int. No. 968,07/20/2024,2024,2024/081,Street,Queens,Mamie Fay Way,Ditmars Boulevard,Female,"Mamie Fay was an influential educator in Queens. She was born in 1872, and dedicated her life to breaking barriers and making a lasting impact in the field of education. In 1925, she became the first principal of P.S. 122Q, located in Astoria. This achie",Between 21st Street and 23rd Street,11105,Cabán,,"MULTILINESTRING ((-73.91674851399995 40.780411109000056, -73.91586835199996 40.779777729000045))",POINT (-73.91630843299995 40.78009441900005),40.78009441900005,-73.91630843299995,17.6%,51%
"MULTILINESTRING ((-73.88037401899999 40.84400906900004, -73.87982327199995 40.844620494000026))",Int. No. 988,07/29/2018,2018,2018/139,Street,Bronx,Lynn Wonsang Way,Vyse Avenue,Female,"Lynn Wonsang founded Unique People Services (UPS), an organization that provides shelter, food and counseling for formerly homeless individuals often struggling with health challenges.  Its Housing Opportunities for Persons with AIDS program serves over",Between East 180th Street and East 181st Street,10460,Torres,,"MULTILINESTRING ((-73.88037401899999 40.84400906900004, -73.87982327199995 40.844620494000026))",POINT (-73.88009864549997 40.84431478150003),40.84431478150003,-73.88009864549997,25.5%,53%
"MULTILINESTRING ((-73.92183306899994 40.81036785600003, -73.91851507699994 40.808966319000035))",Int. No. 825,10/10/2008,2008,2008/048,Street,Manhattan,Sandra Hernandez Place,East 140th Street,Female,"Sandra Hernandez dedicated herself to better the Mott Haven community.  Her life was that of second chances, hope and triumph.  After personal drug and alcohol abuse in the early years of her life, Mrs. Hernandez turned her life around and became the Fou",Between Brook Avenue and Willis Avenue,10454,Mark-Viverito,,"MULTILINESTRING ((-73.92183306899994 40.81036785600003, -73.91851507699994 40.808966319000035))",POINT (-73.92017407299994 40.809667087500024),40.809667087500024,-73.92017407299994,26.5%,52%
"MULTILINESTRING ((-73.93985932399994 40.82028818900005, -73.93730854299997 40.81920223800006))",Int. No. 2477,01/15/2022,2022,2022/054,Street,Manhattan,Althea Gibson Street,,Female,"Althea Gibson was an American tennis player who dominated women’s competition in the late 1950s. She was the first African American player to win the French, Wimbledon and U.S. Open singles championships. She grew up in New York City, w",At the intersection of West 143rd Street between Adam Clayton Powell Jr Boulevard and Malcolm X Boulevard,10030,Perkins,,"MULTILINESTRING ((-73.93985932399994 40.82028818900005, -73.93730854299997 40.81920223800006))",POINT (-73.93858393349996 40.819745213500056),40.819745213500056,-73.93858393349996,26.5%,52%
"MULTILINESTRING ((-73.91843633099995 40.70742566200005, -73.91773359199993 40.70811696200008))",Int. No. 620,02/05/2015,2015,2015/015,Street,Queens,Ann Maggio Way,Suydam Street,Female,"Ann Maggio was a teacher at St. Aloysius.  She served as the president of Citizens for a Better Ridgewood, a member of Community Board 5, president of the Suydam Street Block Association, and a member of the Onderdonk Civics’ board of directors.  She f",Between Cypress Avenue and the Grover Cleveland Athletic Field,11385,Reynoso,,"MULTILINESTRING ((-73.91843633099995 40.70742566200005, -73.91773359199993 40.70811696200008))",POINT (-73.91808496149994 40.70777131200006),40.70777131200006,-73.91808496149994,17.6%,51%
"MULTILINESTRING ((-74.01024493099999 40.651446615000054, -74.00867583899998 40.65050645900004))",Int. No. 281-A,05/05/2004,2004,2004/008,Street,Brooklyn,Sister Mary Geraldine Tobis Way,43rd Street,Female,"Sister Mary Geraldine Tobia, a stalwart of the southwest Brooklyn community, gave years of service to the children, families, newly arrived immigrant groups and the myriad of groups that comprise the gorgeous mosaic that is New York City.  A Magna Cum La",between 3rd Avenue and 4th Avenue,11232,Gonzalez,,"MULTILINESTRING ((-74.01024493099999 40.651446615000054, -74.00867583899998 40.65050645900004))",POINT (-74.00946038499998 40.65097653700005),40.65097653700005,-74.00946038499998,22.1%,52%
"MULTILINESTRING ((-73.95422660799994 40.80060021000003, -73.95259145399996 40.799914382000054))",Int. No. 968,07/20/2024,2024,2024/081,Street,Manhattan,Helene Nomsa Brath Way,West 112th Street,Female,"Helene Nomsa Brath was a community organizer, activist, educator and artist. She was a pioneer in the Black Arts Movement and was one of the founding members of the Grandassa Models, which centered on natural Black beauty in African-American women. She c",Between Adam Clayton Powell Jr. Boulevard and St. Nicholas Avenue,10026,Salaam,,"MULTILINESTRING ((-73.95422660799994 40.80060021000003, -73.95259145399996 40.799914382000054))",POINT (-73.95340903099995 40.80025729600004),40.80025729600004,-73.95340903099995,26.5%,52%
"MULTILINESTRING ((-73.95297440399997 40.81426742000008, -73.95142408699996 40.813613762000045))",Int. No. 590-A,07/11/2011,2011,2011/047,Street,Manhattan,Ramona Jennett Way,West 129th Street,Female,"Ramona Jennett served as president of the 129th Street Block Association, secretary of Community Board 9, was Treasurer of the Women’s Democratic Club, parent coordinator at P.S. 129 and a staff member of New York Hospital’s Intensive Care Unit for B",Between Convent Avenue and St. Nicholas Terrace,10027,Dickens,,"MULTILINESTRING ((-73.95297440399997 40.81426742000008, -73.95142408699996 40.813613762000045))",POINT (-73.95219924549997 40.81394059100006),40.81394059100006,-73.95219924549997,26.5%,52%
"MULTILINESTRING ((-73.99903520199996 40.65927062600008, -73.99702354599998 40.65806199200006))",Int. No. 746-A,12/29/2005,2005,2005/131,Street,Brooklyn,Sister Mary Franciscus Way,27th Street,Female,"Sister Mary Franciscus was the Chairperson of the Youth Committee of CB 7 in Brooklyn, where she was instrumental in developing the idea for Oppportunities for a Better Tomorrow (OBT), a comprehensive job training/placement program and GED program to ser",Between 4th and 5th Avenues,11232,Gonzalez,,"MULTILINESTRING ((-73.99903520199996 40.65927062600008, -73.99702354599998 40.65806199200006))",POINT (-73.99802937399997 40.65866630900007),40.65866630900007,-73.99802937399997,22.1%,52%
"MULTILINESTRING ((-73.90211410499995 40.82973247600006, -73.90039480899998 40.83112876300004))",Int. No. 1744,12/01/2017,2017,2017/237,Street,Bronx,EMT Yadira Arroyo Way,Boston Road,Female,Yadira Arroyo was killed in the line of duty when a man was trying to steal her FDNY ambulance and struck her.,Between East 168th Street and East 169th Street,10456,Gibson,,"MULTILINESTRING ((-73.90211410499995 40.82973247600006, -73.90039480899998 40.83112876300004))",POINT (-73.90125445699996 40.83043061950005),40.83043061950005,-73.90125445699996,25.5%,53%
